{
  "version": 1,
  "note": "Hardware profiles and per-scanner cost classes for the scanner performance panel. A profile declares a machine's CAPABILITY; a scanner declares its COST; the tuning is derived from the two by monitor/perf-tuning.mjs. It is deliberately not a profile-by-scanner matrix: 11 profiles by 43 checks is 473 cells nobody could keep true, and the first one that went stale would be indistinguishable from a deliberate setting. Every number here is a declared default, not a measurement, except where measuredFrom names a commit. Scanners may declare minDepth to override their cost class: cost is what a run costs, depth is what a run is for, and the two come apart (a secret scan is expensive and belongs at triage depth). Profiles carry modelMatch patterns so the CPU model string is asked first; a name match beats an arithmetic one, and where the real machine has more cores or memory than the profile declares, the MEASURED figure is used and the profile supplies only disk class and container availability.",
  "measuredFrom": {
    "coresPerJobHigh": "As of 2026-08-22, eleven concurrent sweeps on an 18-core, 48 GB machine drove load to 87 with 1 GB free, and per-repo time rose from 2.6 to 30 minutes. As of 2026-08-23, --jobs 8 on the same machine held load at 96-106. Semgrep alone takes ~2 cores per repository at full intensity, which is where coresPerJob = 2.5 at intensity 5 comes from.",
    "slotsDefault": "monitor/sweep-slot.mjs DEFAULT_SLOTS = 4, fleet-wide."
  },
  "diskClasses": {
    "nvme": {
      "label": "NVMe SSD",
      "jobsMultiplier": 1,
      "note": "Scanners are IO-heavy on checkout and extraction; NVMe is the assumed baseline."
    },
    "sata-ssd": {
      "label": "SATA SSD",
      "jobsMultiplier": 0.75,
      "note": "Roughly a quarter fewer parallel repositories before IO becomes the limit."
    },
    "hdd": {
      "label": "Spinning disk",
      "jobsMultiplier": 0.34,
      "note": "Container image extraction and git checkout dominate. Parallelism past 2 makes a mechanical disk slower, not faster."
    },
    "network": {
      "label": "Network or external volume",
      "jobsMultiplier": 0.34,
      "note": "Treated as a spinning disk: latency, not bandwidth, is the constraint."
    }
  },
  "profiles": {
    "auto": {
      "id": "auto",
      "label": "Auto-detect this machine",
      "vendor": "detected",
      "cores": null,
      "threads": null,
      "ramGB": null,
      "diskClass": null,
      "containers": null,
      "note": "Reads the running machine and matches the nearest declared profile. Chosen defaults are shown so they can be overridden."
    },
    "m4-pro": {
      "id": "m4-pro",
      "label": "Apple M4 Pro",
      "vendor": "apple",
      "arch": "arm64",
      "cores": 12,
      "threads": 12,
      "ramGB": 24,
      "diskClass": "nvme",
      "containers": true,
      "note": "12-core (8 performance + 4 efficiency) at 24 GB is the common configuration; the 14-core/48 GB part is faster but the defaults here hold for both. Containers run under a virtual machine, which costs roughly 2 cores and 4 GB before any scanner starts.",
      "modelMatch": [
        "apple m4 pro",
        "apple m4 max"
      ]
    },
    "m5-pro": {
      "id": "m5-pro",
      "label": "Apple M5 Pro",
      "vendor": "apple",
      "arch": "arm64",
      "cores": 18,
      "threads": 18,
      "ramGB": 48,
      "diskClass": "nvme",
      "containers": true,
      "note": "Core and memory figures are read from a host whose CPU model string reports \"Apple M5 Pro\". Containers run under a virtual machine, which costs roughly 2 cores and 4 GB before any scanner starts.",
      "modelMatch": [
        "apple m5 pro",
        "apple m5 max"
      ]
    },
    "m3-pro": {
      "id": "m3-pro",
      "label": "Apple M3 Pro",
      "vendor": "apple",
      "arch": "arm64",
      "cores": 11,
      "threads": 11,
      "ramGB": 18,
      "diskClass": "nvme",
      "containers": true,
      "note": "11-core / 18 GB. Memory rather than cores is the binding constraint once the container VM and a local model are both resident.",
      "modelMatch": [
        "apple m3 pro",
        "apple m3 max"
      ]
    },
    "apple-air": {
      "id": "apple-air",
      "label": "Apple silicon laptop, base (M1/M2/M3/M4 Air)",
      "vendor": "apple",
      "arch": "arm64",
      "cores": 8,
      "threads": 8,
      "ramGB": 16,
      "diskClass": "nvme",
      "containers": true,
      "note": "The floor case for a modern laptop, and passively cooled: sustained multi-core load throttles within minutes, so the depth ceiling matters more here than the job count.",
      "modelMatch": [
        "apple m1",
        "apple m2",
        "apple m3",
        "apple m4",
        "apple m5"
      ]
    },
    "ryzen5-5600x": {
      "id": "ryzen5-5600x",
      "label": "AMD Ryzen 5 5600X / 5600 desktop",
      "vendor": "amd",
      "arch": "x64",
      "cores": 6,
      "threads": 12,
      "ramGB": 32,
      "diskClass": "sata-ssd",
      "containers": true,
      "note": "6 cores / 12 threads. Covers the Ryzen 5 5600, 5600X and 5600G; the 5600 XT is a graphics card, not a CPU. Under Windows, containers run through WSL2, which costs about 2 GB before any scanner starts.",
      "modelMatch": [
        "ryzen 5 5600",
        "ryzen 5 3600",
        "ryzen 5 7600"
      ]
    },
    "ryzen7-desktop": {
      "id": "ryzen7-desktop",
      "label": "AMD Ryzen 7 / Intel i5 desktop, 8-core",
      "vendor": "amd",
      "arch": "x64",
      "cores": 8,
      "threads": 16,
      "ramGB": 32,
      "diskClass": "nvme",
      "containers": true,
      "note": "The common self-built desktop: 8 cores, 32 GB, NVMe. Comfortably runs every lane including the containerised ones.",
      "modelMatch": [
        "ryzen 7",
        "ryzen 9",
        "core i5",
        "i5-1"
      ]
    },
    "core-i7-2026": {
      "id": "core-i7-2026",
      "label": "Intel Core Ultra 7, current generation",
      "vendor": "intel",
      "arch": "x64",
      "cores": 16,
      "threads": 22,
      "ramGB": 32,
      "diskClass": "nvme",
      "containers": true,
      "note": "Hybrid performance and efficiency cores. Core count overstates capacity here: the efficiency cores are markedly slower on the single-threaded parsing that dominates several lanes, so jobs are derived from performance cores rather than the total.",
      "modelMatch": [
        "core ultra 7",
        "core ultra 9",
        "core i7",
        "i7-1",
        "core i9"
      ]
    },
    "dgx-spark": {
      "id": "dgx-spark",
      "label": "NVIDIA DGX Spark",
      "vendor": "nvidia",
      "arch": "arm64",
      "cores": 20,
      "threads": 20,
      "ramGB": 128,
      "diskClass": "nvme",
      "containers": true,
      "note": "20 Arm cores with 128 GB of unified memory. Memory stops being the constraint entirely, so every lane can run at full depth concurrently and a local model can stay resident beside them. The GPU is not used by any scanner today; it is available to the LLM-assisted remediation path.",
      "modelMatch": [
        "gb10",
        "dgx spark",
        "grace blackwell"
      ]
    },
    "dgx-spark-dual": {
      "id": "dgx-spark-dual",
      "label": "NVIDIA DGX Spark, two linked",
      "vendor": "nvidia",
      "arch": "arm64",
      "cores": 40,
      "threads": 40,
      "ramGB": 256,
      "diskClass": "nvme",
      "containers": true,
      "note": "Two units over the high-speed interconnect. The job count derived here assumes both are scanning the same fleet from one scheduler; commitwork does not yet distribute a sweep across two hosts, so treat this as the ceiling once it does, not as something the current scheduler achieves.",
      "modelMatch": []
    },
    "legacy-hdd": {
      "id": "legacy-hdd",
      "label": "Older machine on a spinning disk",
      "vendor": "generic",
      "arch": "x64",
      "cores": 4,
      "threads": 8,
      "ramGB": 8,
      "diskClass": "hdd",
      "containers": false,
      "note": "4 cores, 8 GB, mechanical disk, no container runtime. Every containerised lane is unavailable rather than slow, and the panel says so instead of showing them as passing. This profile exists because 'runs on consumer hardware' has to mean something at the bottom of the range, not only at the top.",
      "modelMatch": []
    }
  },
  "costClasses": {
    "light": {
      "coresPerRun": 0.25,
      "ramGB": 0.25,
      "timeoutMs": 300000,
      "minDepth": 1,
      "note": "Seconds. Text or config parsing, no index built."
    },
    "medium": {
      "coresPerRun": 1,
      "ramGB": 1,
      "timeoutMs": 900000,
      "minDepth": 2,
      "note": "Under a couple of minutes on a normal repository."
    },
    "heavy": {
      "coresPerRun": 2,
      "ramGB": 3,
      "timeoutMs": 2700000,
      "minDepth": 3,
      "note": "Minutes. Usually a container, a full history walk, or a network fetch."
    },
    "very-heavy": {
      "coresPerRun": 3,
      "ramGB": 6,
      "timeoutMs": 14400000,
      "minDepth": 4,
      "note": "Builds a database or fuzzes a live target. Tens of minutes to hours; this is the class that decides whether a nightly finishes."
    }
  },
  "scanners": {
    "secrets": {
      "cost": "heavy",
      "container": false,
      "note": "Walks the whole git history.",
      "minDepth": 1,
      "depthLadder": [
        {
          "label": "recent",
          "note": "the newest 1,000 commits (trufflehog --max-depth=1000)"
        },
        {
          "label": "full",
          "note": "the whole git history — the lane as it ran before ladders"
        }
      ]
    },
    "secrets-gitleaks": {
      "cost": "light",
      "container": false,
      "minDepth": 1
    },
    "secrets-betterleaks": {
      "cost": "light",
      "container": false,
      "minDepth": 1
    },
    "sast": {
      "cost": "very-heavy",
      "container": false,